[
  {
    "name": "Magdalena Andersson",
    "slug": "magdalena-andersson",
    "party": "s",
    "role": "partiledare",
    "riksdagen_id": "0987654321098",
    "image_url": null
  },
  {
    "name": "Ulf Kristersson",
    "slug": "ulf-kristersson",
    "party": "m",
    "role": "statsminister",
    "riksdagen_id": "0123456789012",
    "image_url": null
  },
  {
    "name": "Jimmie Åkesson",
    "slug": "jimmie-akesson",
    "party": "sd",
    "role": "partiledare",
    "riksdagen_id": "0234567890123",
    "image_url": null
  },
  {
    "name": "Muharrem Demirok",
    "slug": "muharrem-demirok",
    "party": "c",
    "role": "partiledare",
    "riksdagen_id": null,
    "image_url": null
  },
  {
    "name": "Nooshi Dadgostar",
    "slug": "nooshi-dadgostar",
    "party": "v",
    "role": "partiledare",
    "riksdagen_id": "0345678901234",
    "image_url": null
  },
  {
    "name": "Ebba Busch",
    "slug": "ebba-busch",
    "party": "kd",
    "role": "partiledare",
    "riksdagen_id": "0456789012345",
    "image_url": null
  },
  {
    "name": "Johan Pehrson",
    "slug": "johan-pehrson",
    "party": "l",
    "role": "partiledare",
    "riksdagen_id": "0567890123456",
    "image_url": null
  }
]
